{
  "version": "2.0.0",
  "generatedAt": "2026-09-19T17:18:46.197Z",
  "domains": {
    "testing": {
      "description": "软件工程测试规范族 (11包: Oracle元规则, 绿场BDD/TDD, 棕场表征锁定, 性质变异, Rust/Py/JS/Go地道测试, CLI/爬虫场景, FFI契约)",
      "skills": [
        "testing-core-oracle",
        "testing-workflow-spec",
        "testing-workflow-characterize",
        "testing-property-mutation",
        "testing-rust-idiom",
        "testing-python-idiom",
        "testing-js-idiom",
        "testing-go-idiom",
        "testing-scenario-cli",
        "testing-scenario-scraper",
        "testing-scenario-embed-ffi"
      ],
      "triggers": [
        "测试",
        "单测",
        "覆盖率",
        "测试用例",
        "测试规范",
        "测试覆盖",
        "测试体系",
        "测试计划",
        "单元测试",
        "性质测试",
        "变异测试",
        "表征测试",
        "契约测试",
        "集成测试",
        "回归测试",
        "tdd",
        "bdd",
        "pytest",
        "cargo test",
        "miri",
        "vitest",
        "jest",
        "hypothesis",
        "proptest",
        "test framework",
        "oracle",
        "golden test",
        "spec test",
        "unit test",
        "testing",
        "property-based",
        "mutation testing",
        "爬虫",
        "采集",
        "清洗",
        "命令行",
        "退出码",
        "cli",
        "行为快照",
        "锁定行为",
        "ffi",
        "pyo3",
        "v8",
        "isolate",
        "跨语言"
      ],
      "negatives": [
        "脱壳",
        "反编译",
        "ida pro",
        "gdb",
        "rop",
        "pwn",
        "hook_installed",
        "抓包",
        "绕过frida",
        "渗透测试",
        "安全测试",
        "pentest"
      ],
      "defaultRecipe": "spec-driven-greenfield"
    },
    "reverse": {
      "description": "逆向工程、协议分析、二进制与移动端安全分析 (APK/IDA/JS/Frida/Pwn/固件)",
      "skills": [
        "reverse-skill-router",
        "apk-reverse",
        "ida-reverse",
        "radare2",
        "js-reverse",
        "mobile-reverse",
        "dotnet-reverse",
        "malware-analysis",
        "reverse-engineering",
        "protocol-reverse",
        "firmware-pentest",
        "ghidra-reverse",
        "pwn-chain",
        "patch-diff-exploit",
        "binary-diff",
        "go-rust-reverse",
        "macos-reverse",
        "antibot-fingerprint-paradigm"
      ],
      "triggers": [
        "逆向",
        "反编译",
        "脱壳",
        "frida",
        "ida",
        "ghidra",
        "radare2",
        "jadx",
        "smali",
        "apk逆向",
        "jsvmp",
        "补环境",
        "混淆还原",
        "ast解混淆",
        "抓包分析",
        "协议分析",
        "私有协议",
        "签名算法",
        "sign算法",
        "so逆向",
        "rop",
        "pwn",
        "固件提取",
        "指纹",
        "ja3",
        "ja4",
        "风控",
        "反爬",
        "指纹浏览器",
        "webdriver检测",
        "tls指纹",
        "headless检测",
        "bot detection",
        "fingerprint",
        "渗透测试",
        "安全测试",
        "pentest",
        "penetration",
        "渗透",
        "反汇编",
        "反混淆",
        "栈溢出",
        "利用链",
        "安装包",
        "小程序",
        "二进制分析",
        "抓包"
      ],
      "negatives": [
        "单元测试",
        "测试覆盖",
        "pytest",
        "cargo test",
        "tdd",
        "bdd",
        "覆盖设计",
        "性质测试",
        "变异测试",
        "测试规范",
        "测试体系",
        "ui设计",
        "前端布局"
      ],
      "defaultRecipe": "reverse-general"
    },
    "ui": {
      "description": "全局 UI/UX 设计范式知识库与前端交互模式",
      "skills": [
        "ui-design-paradigms"
      ],
      "triggers": [
        "ui",
        "ux",
        "设计范式",
        "前端设计",
        "交互设计",
        "响应式布局",
        "组件库",
        "界面风格",
        "tailwind",
        "shadcn",
        "design tokens",
        "视觉规范",
        "色彩体系",
        "响应式",
        "配色",
        "交互规范",
        "布局规范"
      ],
      "negatives": [
        "脱壳",
        "反编译",
        "ida",
        "frida",
        "漏洞利用",
        "rop",
        "pwn",
        "so逆向"
      ],
      "defaultRecipe": "ui-design-standard"
    },
    "protocol": {
      "description": "私有协议与自动化 UI Oracle 逆向方案",
      "skills": [
        "ui-oracle-protocol",
        "xfqtrace-kit"
      ],
      "triggers": [
        "ui-oracle",
        "timestamper",
        "xfqtrace",
        "流量窗口切片",
        "重放判官",
        "无痕hook",
        "appium",
        "操作到请求",
        "操作→请求",
        "请求映射",
        "生成时机",
        "参数生成时机",
        "点击触发",
        "ui自动化",
        "重放对比",
        "窗口切片",
        "操作验证",
        "什么时候生成",
        "何时生成",
        "哪些请求",
        "什么请求",
        "发出的请求",
        "点击会",
        "生成哪些参数",
        "哪个操作",
        "操作生成"
      ],
      "negatives": [
        "单元测试规范",
        "覆盖设计"
      ],
      "defaultRecipe": "ui-oracle-trace"
    },
    "engineering": {
      "description": "软件工程质量属性与元规范族 (文档四体裁, 视觉排版动线, 质量门禁, 宽结构化事件, 安全供应链, 数据演进契约, B级质量Overlay)",
      "skills": [
        "docs-core-paradigm",
        "docs-presentation-idiom",
        "obs-core-paradigm",
        "sec-core-paradigm",
        "contract-core-paradigm",
        "config-core-paradigm",
        "overlay-core-paradigm",
        "arch-core-paradigm",
        "ming-l-paradigm",
        "ming-skill-forge",
        "ming-experience-direction",
        "ming-distiller"
      ],
      "triggers": [
        "文档",
        "文档体系",
        "仓库文档",
        "readme",
        "文档体裁",
        "diataxis",
        "adr",
        "docs-as-code",
        "架构决策记录",
        "文档排版",
        "readme排版",
        "去emoji",
        "去疲劳",
        "动线",
        "docs-presentation",
        "可观测",
        "日志",
        "observability",
        "structured logging",
        "wide events",
        "宽事件",
        "相关id",
        "安全元规则",
        "ast10",
        "agentic-skills",
        "supply-chain",
        "最小权限",
        "数据契约",
        "schema-evolution",
        "tolerant-reader",
        "data-contract",
        "字段演进",
        "配置",
        "配置归一化",
        "环境变量",
        "特性开关",
        "feature flag",
        "i18n",
        "config",
        "性能",
        "安全",
        "隐私",
        "韧性",
        "上下文成本",
        "可移植",
        "overlay",
        "规范体系",
        "项目分层",
        "治理文档",
        "候审档",
        "ming-l",
        "新技能",
        "写技能",
        "技能包",
        "skill包",
        "skill authoring",
        "frontmatter",
        "体验导演",
        "叙事设计",
        "产品体验设计",
        "scrollytelling",
        "电影感网页",
        "沉浸式体验",
        "设计宪法",
        "storyboard",
        "沉淀",
        "蒸馏",
        "复盘",
        "distill",
        "retrospective",
        "经验回收",
        "查沉淀",
        "项目复盘",
        "六边形架构",
        "hexagonal",
        "ports and adapters",
        "端口适配器",
        "依赖倒置",
        "clean architecture",
        "洋葱架构",
        "架构边界",
        "ffi边界",
        "strangler",
        "排版",
        "logging",
        "telemetry",
        "security",
        "供应链",
        "supply-chain",
        "schemaVersion",
        "env vars",
        "precedence",
        "performance",
        "privacy",
        "设计域",
        "skill-creator",
        "渐进披露",
        "immersive",
        "媒介映射",
        "design pipeline",
        "设计门禁",
        "ffi",
        "pyo3",
        "v8",
        "v8-isolate",
        "isolate",
        "跨语言",
        "埋点",
        "告警",
        "调用链",
        "排障",
        "schema",
        "向后兼容",
        "兼容性",
        "依赖边界",
        "模块边界",
        "规范归属",
        "电影感",
        "滚动叙事",
        "叙事页",
        "沉浸",
        "哪个域"
      ],
      "qualityGateTriggers": [
        "质量门禁",
        "门禁",
        "git hooks",
        "pre-commit",
        "pre-push",
        "ci",
        "ci/cd",
        "runner",
        "影响面",
        "affected",
        "sbom",
        "sca",
        "freshness",
        "制品门禁"
      ],
      "negatives": [
        "脱壳",
        "反编译",
        "ida pro",
        "gdb",
        "rop",
        "pwn"
      ],
      "defaultRecipe": "engineering-meta-catalog",
      "skillTriggers": {
        "docs-core-paradigm": [
          "文档",
          "diataxis",
          "adr",
          "docs-as-code"
        ],
        "docs-presentation-idiom": [
          "排版",
          "readme",
          "动线"
        ],
        "obs-core-paradigm": [
          "日志",
          "可观测",
          "observability",
          "logging",
          "telemetry",
          "宽事件",
          "相关id"
        ],
        "sec-core-paradigm": [
          "安全",
          "security",
          "供应链",
          "supply-chain",
          "最小权限",
          "ast10"
        ],
        "contract-core-paradigm": [
          "数据契约",
          "字段演进",
          "schema-evolution",
          "schemaVersion",
          "tolerant-reader",
          "data-contract"
        ],
        "config-core-paradigm": [
          "配置",
          "配置归一化",
          "环境变量",
          "env vars",
          "特性开关",
          "feature flag",
          "i18n",
          "config",
          "precedence"
        ],
        "overlay-core-paradigm": [
          "性能",
          "performance",
          "隐私",
          "privacy",
          "韧性",
          "可移植",
          "上下文成本",
          "overlay"
        ],
        "arch-core-paradigm": [
          "六边形架构",
          "hexagonal",
          "ports and adapters",
          "端口适配器",
          "依赖倒置",
          "clean architecture",
          "洋葱架构",
          "架构边界",
          "ffi边界",
          "strangler"
        ],
        "ming-l-paradigm": [
          "项目分层",
          "规范体系",
          "治理文档",
          "候审档",
          "ming-l",
          "domain",
          "设计域"
        ],
        "ming-skill-forge": [
          "新技能",
          "写技能",
          "技能包",
          "skill包",
          "skill authoring",
          "skill-creator",
          "frontmatter",
          "渐进披露"
        ],
        "ming-experience-direction": [
          "体验导演",
          "叙事设计",
          "产品体验设计",
          "scrollytelling",
          "电影感网页",
          "沉浸式体验",
          "immersive",